{"admission":"NOT_QUALIFIED","board_id":"apple:j313","board_selector":"j313","capabilities":[{"applicability":"unknown","capability_id":"audio","evidence_ids":[],"status":"unknown","threshold_met":false},{"applicability":"unknown","capability_id":"backlight","evidence_ids":[],"status":"unknown","threshold_met":false},{"applicability":"unknown","capability_id":"bluetooth","evidence_ids":[],"status":"unknown","threshold_met":false},{"applicability":"unknown","capability_id":"boot","evidence_ids":[],"status":"unknown","threshold_met":false},{"applicability":"unknown","capability_id":"camera","evidence_ids":[],"status":"unknown","threshold_met":false},{"applicability":"unknown","capability_id":"charging-battery","evidence_ids":[],"status":"unknown","threshold_met":false},{"applicability":"unknown","capability_id":"device-tree","evidence_ids":[],"status":"unknown","threshold_met":false},{"applicability":"unknown","capability_id":"ethernet","evidence_ids":[],"status":"unknown","threshold_met":false},{"applicability":"unknown","capability_id":"external-display","evidence_ids":[],"status":"unknown","threshold_met":false},{"applicability":"unknown","capability_id":"firmware","evidence_ids":[],"status":"unknown","threshold_met":false},{"applicability":"unknown","capability_id":"gpu","evidence_ids":[],"status":"unknown","threshold_met":false},{"applicability":"unknown","capability_id":"internal-display","evidence_ids":[],"status":"unknown","threshold_met":false},{"applicability":"unknown","capability_id":"kernel","evidence_ids":[],"status":"unknown","threshold_met":false},{"applicability":"unknown","capability_id":"keyboard","evidence_ids":[],"status":"unknown","threshold_met":false},{"applicability":"unknown","capability_id":"media","evidence_ids":[],"status":"unknown","threshold_met":false},{"applicability":"unknown","capability_id":"memory","evidence_ids":[],"status":"unknown","threshold_met":false},{"applicability":"unknown","capability_id":"nvme","evidence_ids":[],"status":"unknown","threshold_met":false},{"applicability":"unknown","capability_id":"recovery","evidence_ids":[],"status":"unknown","threshold_met":false},{"applicability":"unknown","capability_id":"sd","evidence_ids":[],"status":"unknown","threshold_met":false},{"applicability":"unknown","capability_id":"suspend-resume","evidence_ids":[],"status":"unknown","threshold_met":false},{"applicability":"unknown","capability_id":"thermal-fan","evidence_ids":[],"status":"unknown","threshold_met":false},{"applicability":"unknown","capability_id":"thunderbolt","evidence_ids":[],"status":"unknown","threshold_met":false},{"applicability":"unknown","capability_id":"touch-id-sep","evidence_ids":[],"status":"unknown","threshold_met":false},{"applicability":"unknown","capability_id":"trackpad","evidence_ids":[],"status":"unknown","threshold_met":false},{"applicability":"unknown","capability_id":"usb","evidence_ids":[],"status":"unknown","threshold_met":false},{"applicability":"unknown","capability_id":"virtualization","evidence_ids":[],"status":"unknown","threshold_met":false},{"applicability":"unknown","capability_id":"wifi","evidence_ids":[],"status":"unknown","threshold_met":false}],"evidence":[],"f02_schema_set_digest":"sha256:c5edcb0c08158a5ac6c985432a386ad07b3c478c48df44f5040918eb8947d6bb","firmware_baseline":{"build":"unknown","captured_at":"2026-09-03T00:00:00Z","firmware_id":"unknown","version":"unknown"},"intake_dataset_digest":"sha256:b0a4e31840d8457de4f8af27ed0b42ef5377caff0a6d89e80af7ae5f4e38e246","intake_record_digest":"sha256:dbf8112dfd4af7d1316735fca647fcfe65d5497abeef0f0a16c4860768b537dd","intake_record_id":"apple:j313","issued_at":"2026-09-03T00:00:00Z","manifest_digest":"sha256:1111111111111111111111111111111111111111111111111111111111111111","manifest_id":"manifest:not-qualified","outcome":"UNKNOWN","physical_units":[],"profile_id":"profile:j313-macbookair10-1","record_id":"qualification:apple-j313:2026-09-03.r1","redaction":{"applied":false,"policy":"none","residuals":["physical-evidence-not-collected"]},"residuals":[{"reason":"Firmware baseline is unknown until lab capture.","residual_id":"firmware-baseline","state":"unknown"},{"reason":"No physical units or evidence have been collected.","residual_id":"physical-evidence","state":"blocked"}],"schema":"qualification-record/q01-v1","schema_set_digest":"sha256:73fb829227616301668d4900cf37bf5a0f03d354450809d89f71acb704c361c0","tool_versions":{"schema":"q01-v1","validator":"omarchy-qualification-1.0"},"validated_at":"2026-09-03T00:00:00Z"}
